<?xml version="1.0"?>
<!-- Copyright Yahoo. Licensed under the terms of the Apache 2.0 license. See LICENSE in the project root. -->
<!DOCTYPE sortOrder SYSTEM "AlphaSort1_0.dtd">
<sortOrder>  
   <sortValue>
      <unicode>
         <hex> 0391 </hex>
      </unicode>
      <unicode>
         <hex> 03B1 </hex>
      </unicode>
   </sortValue>
   <sortValue>
      <unicode>
         <hex> 0392 </hex>
      </unicode>
      <unicode>
         <hex> 03B2 </hex>
      </unicode>
   </sortValue>
   <sortValue>
      <unicode>
         <hex> 0393 </hex>
      </unicode>
      <unicode>
         <hex> 03B3 </hex>
      </unicode>
   </sortValue>
   <sortValue>
      <unicode>
         <hex> 0394 </hex>
      </unicode>
      <unicode>
         <hex> 03B4 </hex>
      </unicode>
   </sortValue>
   <sortValue>
      <unicode>
         <hex> 0395 </hex>
      </unicode>
      <unicode>
         <hex> 03B5 </hex>
      </unicode>
   </sortValue>
   <sortValue>
      <unicode>
         <hex> 0396 </hex>
      </unicode>
      <unicode>
         <hex> 03B6 </hex>
      </unicode>
   </sortValue>
   <sortValue>
      <unicode>
         <hex> 0397 </hex>
      </unicode>
      <unicode>
         <hex> 03B7 </hex>
      </unicode>
   </sortValue>
   <sortValue>
      <unicode>
         <hex> 0398 </hex>
      </unicode>
      <unicode>
         <hex> 03B8 </hex>
      </unicode>
   </sortValue>
   <sortValue>
      <unicode>
         <hex> 0399 </hex>
      </unicode>
      <unicode>
         <hex> 03B9 </hex>
      </unicode>
   </sortValue>
   <sortValue>
      <unicode>
         <hex> 039A </hex>
      </unicode>
      <unicode>
         <hex> 03BA </hex>
      </unicode>
   </sortValue>
   <sortValue>
      <unicode>
         <hex> 039B </hex>
      </unicode>
      <unicode>
         <hex> 03BB </hex>
      </unicode>
   </sortValue>
   <sortValue>
      <unicode>
         <hex> 039C </hex>
      </unicode>
      <unicode>
         <hex> 03BC </hex>
      </unicode>
   </sortValue>
   <sortValue>
      <unicode>
         <hex> 039D </hex>
      </unicode>
      <unicode>
         <hex> 03BD </hex>
      </unicode>
   </sortValue>
   <sortValue>
      <unicode>
         <hex> 039E </hex>
      </unicode>
      <unicode>
         <hex> 03BE </hex>
      </unicode>
   </sortValue>
   <sortValue>
      <unicode>
         <hex> 039F </hex>
      </unicode>
      <unicode>
         <hex> 03BF </hex>
      </unicode>
   </sortValue>
   <sortValue>
      <unicode>
         <hex> 03A0 </hex>
      </unicode>
      <unicode>
         <hex> 03C0 </hex>
      </unicode>
   </sortValue>
   <sortValue>
      <unicode>
         <hex> 03A1 </hex>
      </unicode>
      <unicode>
         <hex> 03C1 </hex>
      </unicode>
   </sortValue>
   <sortValue>
      <unicode>
         <hex> 03A2 </hex>
      </unicode>
      <unicode>
         <hex> 03C2 </hex>
      </unicode>
   </sortValue>
   <sortValue>
      <unicode>
         <hex> 03A3 </hex>
      </unicode>
      <unicode>
         <hex> 03C3 </hex>
      </unicode>
   </sortValue>
   <sortValue>
      <unicode>
         <hex> 03A4 </hex>
      </unicode>
      <unicode>
         <hex> 03C4 </hex>
      </unicode>
   </sortValue>
   <sortValue>
      <unicode>
         <hex> 03A5 </hex>
      </unicode>
      <unicode>
         <hex> 03C5 </hex>
      </unicode>
   </sortValue>
   <sortValue>
      <unicode>
         <hex> 03A6 </hex>
      </unicode>
      <unicode>
         <hex> 03C6 </hex>
      </unicode>
   </sortValue>
   <sortValue>
      <unicode>
         <hex> 03A7 </hex>
      </unicode>
      <unicode>
         <hex> 03C7 </hex>
      </unicode>
   </sortValue>
   <sortValue>
      <unicode>
         <hex> 03A8 </hex>
      </unicode>
      <unicode>
         <hex> 03C8 </hex>
      </unicode>
   </sortValue>
   <sortValue>
      <unicode>
         <hex> 03A9 </hex>
      </unicode>
      <unicode>
         <hex> 03C9 </hex>
      </unicode>
   </sortValue>
</sortOrder>  

