<?xml version="1.0"?>
<!-- Copyright Yahoo. Licensed under the terms of the Apache 2.0 license. See LICENSE in the project root. -->
<!DOCTYPE sortOrder SYSTEM "AlphaSort1_0.dtd">
<sortOrder>  
   <sortValue>
      <unicode>
         <hex> 05D0 </hex>
      </unicode>
   </sortValue>
   <sortValue>
      <unicode>
         <hex> 05D1 </hex>
      </unicode>
   </sortValue>
   <sortValue>
      <unicode>
         <hex> 05D2 </hex>
      </unicode>
   </sortValue>
   <sortValue>
      <unicode>
         <hex> 05D3 </hex>
      </unicode>
   </sortValue>
   <sortValue>
      <unicode>
         <hex> 05D4 </hex>
      </unicode>
   </sortValue>
   <sortValue>
      <unicode>
         <hex> 05D5 </hex>
      </unicode>
   </sortValue>
   <sortValue>
      <unicode>
         <hex> 05D6 </hex>
      </unicode>
   </sortValue>
   <sortValue>
      <unicode>
         <hex> 05D7 </hex>
      </unicode>
   </sortValue>
   <sortValue>
      <unicode>
         <hex> 05D8 </hex>
      </unicode>
   </sortValue>
   <sortValue>
      <unicode>
         <hex> 05D9 </hex>
      </unicode>
   </sortValue>
   <sortValue>
      <unicode>
         <hex> 05DA </hex>
      </unicode>
   </sortValue>
   <sortValue>
      <unicode>
         <hex> 05DB </hex>
      </unicode>
   </sortValue>
   <sortValue>
      <unicode>
         <hex> 05DC </hex>
      </unicode>
   </sortValue>
   <sortValue>
      <unicode>
         <hex> 05DD </hex>
      </unicode>
   </sortValue>
   <sortValue>
      <unicode>
         <hex> 05DE </hex>
      </unicode>
   </sortValue>
   <sortValue>
      <unicode>
         <hex> 05DF </hex>
      </unicode>
   </sortValue>
   <sortValue>
      <unicode>
         <hex> 05E0 </hex>
      </unicode>
   </sortValue>
   <sortValue>
      <unicode>
         <hex> 05E1 </hex>
      </unicode>
   </sortValue>
   <sortValue>
      <unicode>
         <hex> 05E2 </hex>
      </unicode>
   </sortValue>
   <sortValue>
      <unicode>
         <hex> 05E3 </hex>
      </unicode>
   </sortValue>
   <sortValue>
      <unicode>
         <hex> 05E4 </hex>
      </unicode>
   </sortValue>
   <sortValue>
      <unicode>
         <hex> 05E5 </hex>
      </unicode>
   </sortValue>
   <sortValue>
      <unicode>
         <hex> 05E6 </hex>
      </unicode>
   </sortValue>
   <sortValue>
      <unicode>
         <hex> 05E7 </hex>
      </unicode>
   </sortValue>
   <sortValue>
      <unicode>
         <hex> 05E8 </hex>
      </unicode>
   </sortValue>
   <sortValue>
      <unicode>
         <hex> 05E9 </hex>
      </unicode>
   </sortValue>
   <sortValue>
      <unicode>
         <hex> 05EA </hex>
      </unicode>
   </sortValue>
</sortOrder>  

