<?xml version="1.0"?>
<!-- Copyright Yahoo. Licensed under the terms of the Apache 2.0 license. See LICENSE in the project root. -->
<!DOCTYPE sortOrder SYSTEM "AlphaSort1_0.dtd">
<sortOrder>  
   <sortValue>
      <unicode>
         <hex> 0627 </hex>
      </unicode>
   </sortValue>
   <sortValue>
      <unicode>
         <hex> 0628 </hex>
      </unicode>
   </sortValue>
   <sortValue>
      <unicode>
         <hex> 0629 </hex>
      </unicode>
   </sortValue>
   <sortValue>
      <unicode>
         <hex> 062A </hex>
      </unicode>
   </sortValue>
   <sortValue>
      <unicode>
         <hex> 062B </hex>
      </unicode>
   </sortValue>
   <sortValue>
      <unicode>
         <hex> 062C </hex>
      </unicode>
   </sortValue>
   <sortValue>
      <unicode>
         <hex> 062D </hex>
      </unicode>
   </sortValue>
   <sortValue>
      <unicode>
         <hex> 062E </hex>
      </unicode>
   </sortValue>
   <sortValue>
      <unicode>
         <hex> 062F </hex>
      </unicode>
   </sortValue>
   <sortValue>
      <unicode>
         <hex> 0630 </hex>
      </unicode>
   </sortValue>
   <sortValue>
      <unicode>
         <hex> 0631 </hex>
      </unicode>
   </sortValue>
   <sortValue>
      <unicode>
         <hex> 0632 </hex>
      </unicode>
   </sortValue>
   <sortValue>
      <unicode>
         <hex> 0633 </hex>
      </unicode>
   </sortValue>
   <sortValue>
      <unicode>
         <hex> 0634 </hex>
      </unicode>
   </sortValue>
   <sortValue>
      <unicode>
         <hex> 0635 </hex>
      </unicode>
   </sortValue>
   <sortValue>
      <unicode>
         <hex> 0636 </hex>
      </unicode>
   </sortValue>
   <sortValue>
      <unicode>
         <hex> 0637 </hex>
      </unicode>
   </sortValue>
   <sortValue>
      <unicode>
         <hex> 0638 </hex>
      </unicode>
   </sortValue>
   <sortValue>
      <unicode>
         <hex> 0639 </hex>
      </unicode>
   </sortValue>
   <sortValue>
      <unicode>
         <hex> 063A </hex>
      </unicode>
   </sortValue>
   <sortValue>
      <unicode>
         <hex> 0641 </hex>
      </unicode>
   </sortValue>
   <sortValue>
      <unicode>
         <hex> 0642 </hex>
      </unicode>
   </sortValue>
   <sortValue>
      <unicode>
         <hex> 0643 </hex>
      </unicode>
   </sortValue>
   <sortValue>
      <unicode>
         <hex> 0644 </hex>
      </unicode>
   </sortValue>
   <sortValue>
      <unicode>
         <hex> 0645 </hex>
      </unicode>
   </sortValue>
   <sortValue>
      <unicode>
         <hex> 0646 </hex>
      </unicode>
   </sortValue>
   <sortValue>
      <unicode>
         <hex> 0647 </hex>
      </unicode>
   </sortValue>
   <sortValue>
      <unicode>
         <hex> 0648 </hex>
      </unicode>
   </sortValue>
   <sortValue>
      <unicode>
         <hex> 0649 </hex>
      </unicode>
   </sortValue>
   <sortValue>
      <unicode>
         <hex> 064A </hex>
      </unicode>
   </sortValue>
</sortOrder>  

